{
  "grader": "multi_tap.v1",
  "description": "Find every instance: every place of a note within a fret window, tapped. Right only when the places tapped are exactly the note's places in the window; a place missed or an extra one is wrong. A tap outside the window, or on a string the layout doesn't have, is rejected.",
  "reference": {
    "instruments": {
      "6ea2d087-ab9c-59dc-9657-8546025414d2": {
        "name": "Acoustic guitar (standard tuning)",
        "tuning": [
          "E2",
          "A2",
          "D3",
          "G3",
          "B3",
          "E4"
        ]
      },
      "00000000-0000-4000-8000-0000000000b1": {
        "name": "Electric bass (standard tuning)",
        "tuning": [
          "E1",
          "A1",
          "D2",
          "G2"
        ]
      }
    }
  },
  "cases": [
    {
      "name": "every place, in any order",
      "item_key": "fretboard_note:6ea2d087-ab9c-59dc-9657-8546025414d2:G",
      "response": {
        "response_type": "multi_tap",
        "fret_window": {
          "from_fret": 3
        },
        "cells": [
          {
            "string": 6,
            "fret": 3
          },
          {
            "string": 1,
            "fret": 3
          },
          {
            "string": 4,
            "fret": 5
          }
        ],
        "latency_ms": 5200
      },
      "expected": {
        "result": "graded",
        "evidence": {
          "source": "auto_graded",
          "correct": true,
          "latency_ms": 5200,
          "answer_key": {
            "note_name": "G",
            "fret_window": {
              "from_fret": 3
            },
            "cells": [
              {
                "string": 1,
                "fret": 3
              },
              {
                "string": 4,
                "fret": 5
              },
              {
                "string": 6,
                "fret": 3
              }
            ]
          }
        }
      }
    },
    {
      "name": "a place missed",
      "item_key": "fretboard_note:6ea2d087-ab9c-59dc-9657-8546025414d2:G",
      "response": {
        "response_type": "multi_tap",
        "fret_window": {
          "from_fret": 3
        },
        "cells": [
          {
            "string": 6,
            "fret": 3
          },
          {
            "string": 1,
            "fret": 3
          }
        ],
        "latency_ms": 4100
      },
      "expected": {
        "result": "graded",
        "evidence": {
          "source": "auto_graded",
          "correct": false,
          "latency_ms": 4100,
          "answer_key": {
            "note_name": "G",
            "fret_window": {
              "from_fret": 3
            },
            "cells": [
              {
                "string": 1,
                "fret": 3
              },
              {
                "string": 4,
                "fret": 5
              },
              {
                "string": 6,
                "fret": 3
              }
            ]
          }
        }
      }
    },
    {
      "name": "an extra place",
      "item_key": "fretboard_note:6ea2d087-ab9c-59dc-9657-8546025414d2:G",
      "response": {
        "response_type": "multi_tap",
        "fret_window": {
          "from_fret": 3
        },
        "cells": [
          {
            "string": 6,
            "fret": 3
          },
          {
            "string": 1,
            "fret": 3
          },
          {
            "string": 4,
            "fret": 5
          },
          {
            "string": 3,
            "fret": 7
          }
        ],
        "latency_ms": 6000
      },
      "expected": {
        "result": "graded",
        "evidence": {
          "source": "auto_graded",
          "correct": false,
          "latency_ms": 6000,
          "answer_key": {
            "note_name": "G",
            "fret_window": {
              "from_fret": 3
            },
            "cells": [
              {
                "string": 1,
                "fret": 3
              },
              {
                "string": 4,
                "fret": 5
              },
              {
                "string": 6,
                "fret": 3
              }
            ]
          }
        }
      }
    },
    {
      "name": "no place tapped",
      "item_key": "fretboard_note:6ea2d087-ab9c-59dc-9657-8546025414d2:G",
      "response": {
        "response_type": "multi_tap",
        "fret_window": {
          "from_fret": 3
        },
        "cells": [],
        "latency_ms": 3000
      },
      "expected": {
        "result": "graded",
        "evidence": {
          "source": "auto_graded",
          "correct": false,
          "latency_ms": 3000,
          "answer_key": {
            "note_name": "G",
            "fret_window": {
              "from_fret": 3
            },
            "cells": [
              {
                "string": 1,
                "fret": 3
              },
              {
                "string": 4,
                "fret": 5
              },
              {
                "string": 6,
                "fret": 3
              }
            ]
          }
        }
      }
    },
    {
      "name": "a window at the nut includes the open strings",
      "item_key": "fretboard_note:6ea2d087-ab9c-59dc-9657-8546025414d2:E",
      "response": {
        "response_type": "multi_tap",
        "fret_window": {
          "from_fret": 0
        },
        "cells": [
          {
            "string": 1,
            "fret": 0
          },
          {
            "string": 6,
            "fret": 0
          },
          {
            "string": 4,
            "fret": 2
          },
          {
            "string": 2,
            "fret": 5
          }
        ],
        "latency_ms": 5800
      },
      "expected": {
        "result": "graded",
        "evidence": {
          "source": "auto_graded",
          "correct": true,
          "latency_ms": 5800,
          "answer_key": {
            "note_name": "E",
            "fret_window": {
              "from_fret": 0
            },
            "cells": [
              {
                "string": 1,
                "fret": 0
              },
              {
                "string": 2,
                "fret": 5
              },
              {
                "string": 4,
                "fret": 2
              },
              {
                "string": 6,
                "fret": 0
              }
            ]
          }
        }
      }
    },
    {
      "name": "bass: the note's places on four strings",
      "item_key": "fretboard_note:00000000-0000-4000-8000-0000000000b1:C",
      "response": {
        "response_type": "multi_tap",
        "fret_window": {
          "from_fret": 2
        },
        "cells": [
          {
            "string": 3,
            "fret": 3
          },
          {
            "string": 1,
            "fret": 5
          }
        ],
        "latency_ms": 3500
      },
      "expected": {
        "result": "graded",
        "evidence": {
          "source": "auto_graded",
          "correct": true,
          "latency_ms": 3500,
          "answer_key": {
            "note_name": "C",
            "fret_window": {
              "from_fret": 2
            },
            "cells": [
              {
                "string": 1,
                "fret": 5
              },
              {
                "string": 3,
                "fret": 3
              }
            ]
          }
        }
      }
    },
    {
      "name": "rejected: a place outside the window",
      "item_key": "fretboard_note:6ea2d087-ab9c-59dc-9657-8546025414d2:G",
      "response": {
        "response_type": "multi_tap",
        "fret_window": {
          "from_fret": 3
        },
        "cells": [
          {
            "string": 6,
            "fret": 3
          },
          {
            "string": 1,
            "fret": 3
          },
          {
            "string": 4,
            "fret": 5
          },
          {
            "string": 2,
            "fret": 8
          }
        ],
        "latency_ms": 5000
      },
      "expected": {
        "result": "rejected",
        "reason": "invalid_cell"
      }
    },
    {
      "name": "rejected: a string the layout doesn't have",
      "item_key": "fretboard_note:00000000-0000-4000-8000-0000000000b1:C",
      "response": {
        "response_type": "multi_tap",
        "fret_window": {
          "from_fret": 2
        },
        "cells": [
          {
            "string": 3,
            "fret": 3
          },
          {
            "string": 5,
            "fret": 3
          }
        ],
        "latency_ms": 3500
      },
      "expected": {
        "result": "rejected",
        "reason": "invalid_cell"
      }
    },
    {
      "name": "rejected: a layout that doesn't exist",
      "item_key": "fretboard_note:00000000-0000-4000-8000-0000000000ff:G",
      "response": {
        "response_type": "multi_tap",
        "fret_window": {
          "from_fret": 3
        },
        "cells": [
          {
            "string": 6,
            "fret": 3
          }
        ],
        "latency_ms": 2000
      },
      "expected": {
        "result": "rejected",
        "reason": "unknown_reference"
      }
    },
    {
      "name": "rejected: naming a note doesn't find every place",
      "item_key": "fretboard_note:6ea2d087-ab9c-59dc-9657-8546025414d2:G",
      "response": {
        "response_type": "name_the_note",
        "note_name": "G",
        "latency_ms": 1500
      },
      "expected": {
        "result": "rejected",
        "reason": "response_does_not_fit_item"
      }
    }
  ]
}
